{
  "template_id": "explain-like-5",
  "version": "1.0",
  "display": {
    "title": "Explain Like I'm 5",
    "one_liner": "Turn any topic into a simple, friendly explanation for young kids.",
    "example_use_cases": [
      "What is gravity?",
      "How do rainbows happen?",
      "Why do we recycle?"
    ]
  },
  "tags": ["education", "explainer", "kids", "science"],
  "inputs": {
    "required": ["child_age", "theme"],
    "optional": [
      "parental_guidance",
      "character_preferences",
      "plot_preferences",
      "language",
      "narrator_voice",
      "reading_level",
      "tone",
      "illustration_style",
      "custom_instructions"
    ]
  },
  "input_specs": [
    {"key": "child_age", "label": "Child Age", "type": "enum", "options": [2, 3, 4, 5, 6, 7], "default": 4},
    {"key": "custom_instructions", "label": "Custom Instructions", "type": "string", "default": ""}
  ],
  "constants": {
    "word_band": {"min_words": 380, "max_words": 420},
    "pagination": {"node_count": 10, "desired_choice_count": 2},
    "media": {"style_guidance_ref": "@explain-like-5.image_style_guidance.json"}
  },
  "stages": {
    "stage1": {
      "system": "You are the Educational Theme Integrator for an interactive storybook generator serving children aged 3-5. Work only with the information provided.",
      "instructions": "Produce a learning blueprint tailored to age and theme (for an explanation), focusing on objectives and simple target skills. If custom instructions are present, respect them when safe and age-appropriate. Output JSON fields: learning_objectives, target_skills, theme_alignment_notes.",
      "input_mapping": {
        "child_age": "{{inputs.child_age}}",
        "theme": "{{inputs.theme}}",
        "parental_guidance": "{{inputs.parental_guidance}}",
        "character_preferences": "{{inputs.character_preferences}}",
        "plot_preferences": "{{inputs.plot_preferences}}",
        "custom_instructions": "{{inputs.custom_instructions}}"
      }
    },
    "stage2": {
      "system": "You are the Story Generator for an interactive childrenâ€™s story (ages 3-5). Use only the supplied context.",
      "instructions": "Write a single friendly explanatory narrative between {{constants.word_band.min_words}} and {{constants.word_band.max_words}} words with simple analogies and a recap. Respect any safe custom instructions provided. Define minimal character_bible (guide or helper) and a single primary setting. Use {{inputs.language}} if provided, tone {{inputs.tone}} if provided, and reading simplicity per {{inputs.reading_level}} if provided.",
      "input_mapping": {
        "learning_framework_json": "{{stage1.output}}",
        "child_age": "{{inputs.child_age}}",
        "theme": "{{inputs.theme}}",
        "parental_guidance": "{{inputs.parental_guidance}}",
        "character_preferences": "{{inputs.character_preferences}}",
        "plot_preferences": "{{inputs.plot_preferences}}",
        "custom_instructions": "{{inputs.custom_instructions}}"
      }
    },
    "stage3": {
      "system": "You orchestrate story pagination and interactive branches for a preschool storybook.",
      "instructions": "Paginate the explanation into nodes and add light comprehension choices. Maintain chronology and positive tone per Stage 3 rules.",
      "input_mapping": {
        "story_draft_json": "{{stage2.output}}",
        "learning_framework_json": "{{stage1.output}}",
        "node_count": "{{constants.pagination.node_count}}",
        "desired_choice_count": "{{constants.pagination.desired_choice_count}}"
      }
    },
    "stage4": {
      "system": "You convert Stage 4 story nodes into display-ready scene text and matching image prompts.",
      "instructions": "Convert nodes into SceneText and ImagePrompt with simple infographics; polish choice text. Follow Stage 4 rules. Append style_prompt_suffix from constants.media.style_guidance_ref (if present) to each ImagePrompt.",
      "input_mapping": {
        "story_node_graph_xml": "{{stage3.output}}",
        "character_bible_json": "{{stage2.output.character_bible}}",
        "style_defaults": "{\"illustration_style\": \"{{inputs.illustration_style}}\", \"narrator_voice\": \"{{inputs.narrator_voice}}\"}"
      }
    }
  },
  "safety": {"age_appropriate": true, "notes": "No PII; avoid complex or scary examples."},
  "outputs": {"expects": ["LearningBlueprint", "StoryDraft", "StoryNodes", "Storyboard"], "format": "JSON"},
  "lookup": {"reading_level_sentence_length": {"preK": 8, "K-2": 12, "A1": 16}}
} 